{
  "schema_version": "1.0",
  "persona_id": "chris-teitzel-mcode-001",
  "assessment_date": "2023-09-25",
  
  "identity": {
    "display_name": "Chris",
    "persona_type": "synthetic_user",
    "source": "mcode_assessment"
  },

  "motivational_core": {
    "top_5": [
      {
        "rank": 1,
        "name": "Identify Potential",
        "score": 10.0,
        "description": "Uncover, discover and harness realized or unrealized potential.",
        "drivers": {
          "dig": "Can see beyond surface qualities to underlying potential",
          "search": "Motivated when finding value in places others have overlooked",
          "retrieve": "Energy focused on drawing out and realizing possibilities",
          "reveal": "Enjoys bringing discoveries to light and seeing them used by others"
        },
        "thriving_environments": [
          "There is much promise and new prospects",
          "Possibility-thinking and ambition are promoted",
          "The culture 'brings out the best in people'",
          "Mentoring, personal and professional growth are highly valued"
        ],
        "struggling_environments": [
          "There is little investment in training or developing people",
          "Simply refining, reengineering or repositioning is the focus",
          "Seeking and envisioning new possibilities are stifled"
        ],
        "flip_side": "Tendency to see the potential in people and possibilities could cause poor investments of resources that never come to fruition."
      },
      {
        "rank": 2,
        "name": "Demonstrate Learning",
        "score": 9.7,
        "description": "Learn how to do something new and to show that you can do it.",
        "drivers": {
          "model": "Enjoys developing knowledge or skill to proficiency, then demonstrating that proficiency",
          "practice": "Motivated to learn or develop basic skills as quickly as possible",
          "example": "Energy comes from teaching, showing, modeling and living out what learned",
          "experiment": "Always learning new things, trying new things, and doing new things"
        },
        "thriving_environments": [
          "Learning and personal growth are essential in the environment",
          "There is application of learning in the work",
          "There is opportunity to present findings and outcomes",
          "There is an opportunity for teaching and modeling"
        ],
        "struggling_environments": [
          "Where there is less flexibility for change",
          "Where the work is defined and structured",
          "Where individualism isn't highly valued or necessary",
          "Where there is limited ability for promotion and advancement"
        ],
        "flip_side": "May feel discontent unless continually learning something new. May experience frustration if others are not open to receiving and adopting things learned."
      },
      {
        "rank": 3,
        "name": "Persuade",
        "score": 9.7,
        "description": "Influence someone's thoughts, feelings or behaviors.",
        "drivers": {
          "engage": "Engages and influences people (or other living things that can be influenced)",
          "push": "Sensitive to dynamics of behavior and adept at getting through to people",
          "reactions": "Interested in both short-term and long-term responses",
          "influential": "Likes to evoke a change in thoughts, feelings, or behavior"
        },
        "thriving_environments": [
          "Sales is a critical component of the company",
          "The flow of interaction and ideas matter",
          "Persuasion is a part of the predominant culture",
          "There is openness to change; allowing for new ways"
        ],
        "struggling_environments": [
          "A highly established culture and values are not prominent",
          "Mass production and high automation define the business",
          "Process and procedure are the focus"
        ],
        "flip_side": "Tendency to focus on response from others could cause overselling ideas and might be distracting to the work. Need to remain self-aware of personal need for a response or feedback."
      },
      {
        "rank": 4,
        "name": "Make An Impact",
        "score": 9.7,
        "description": "Shape and impact the world around you.",
        "drivers": {
          "difference": "Wants to see a distinct impression or real difference made",
          "creativity": "Desires freedom and control to shape things as seen fit",
          "connection": "Encouraged when seeing change in people's behavior",
          "world_changer": "Agent of change"
        },
        "thriving_environments": [
          "The object of products and/or services are people",
          "Bringing a high degree of change is the goal",
          "Individual expression and creativity are welcomed",
          "Vision is ambitious and well-articulated"
        ],
        "struggling_environments": [
          "The company is focused on tasks and processes",
          "There may not be room for creative freedom and expression",
          "Cannot see immediate or tangible results"
        ],
        "flip_side": "Might be subject to over-impacting, over-shaping, trying to make a difference when not needed or required. Could be overly compelled to making the work about self and what is desired."
      },
      {
        "rank": 5,
        "name": "Improve",
        "score": 9.4,
        "description": "Consistently seek to make things better and enhance them.",
        "drivers": {
          "lookout": "Constantly explores surroundings in search of something to improve",
          "expert": "Will find something to revise, remodel, rearrange, or refine",
          "skilled": "Has extensive skills in a variety of environments",
          "refine": "Has a drive to make things better"
        },
        "thriving_environments": [
          "Skills and capabilities are developed",
          "Personal growth is promoted",
          "Things are being brought to new levels of functionality and development",
          "Management is mentoring and investing in employees"
        ],
        "struggling_environments": [
          "Processes are not highly developed",
          "There is a strong sense of tradition and set way of doing things",
          "The products or services are already highly developed"
        ],
        "flip_side": "May be critical of existing standards, processes, pushing against the status quo, which may result in stepping on other people's toes with unwanted advice."
      }
    ],

    "full_ranking": [
      { "rank": 1, "name": "Identify Potential", "score": 10.0 },
      { "rank": 2, "name": "Demonstrate Learning", "score": 9.7 },
      { "rank": 3, "name": "Persuade", "score": 9.7 },
      { "rank": 4, "name": "Make An Impact", "score": 9.7 },
      { "rank": 5, "name": "Improve", "score": 9.4 },
      { "rank": 6, "name": "Experience The Ideal", "score": 9.4 },
      { "rank": 7, "name": "Overcome", "score": 9.2 },
      { "rank": 8, "name": "Meet Needs", "score": 9.2 },
      { "rank": 9, "name": "Collaborate", "score": 8.9 },
      { "rank": 10, "name": "Establish", "score": 8.6 },
      { "rank": 11, "name": "Take Charge", "score": 8.6 },
      { "rank": 12, "name": "Realize The Vision", "score": 8.6 },
      { "rank": 13, "name": "Comprehend And Express", "score": 8.6 },
      { "rank": 14, "name": "Develop", "score": 8.6 },
      { "rank": 15, "name": "Meet The Challenge", "score": 8.0 },
      { "rank": 16, "name": "Be Key", "score": 7.8 },
      { "rank": 17, "name": "Mastery", "score": 7.8 },
      { "rank": 18, "name": "Gain Ownership", "score": 7.8 },
      { "rank": 19, "name": "Design", "score": 7.5 },
      { "rank": 20, "name": "Explore", "score": 7.2 },
      { "rank": 21, "name": "Be Unique", "score": 7.2 },
      { "rank": 22, "name": "Make It Work", "score": 7.2 },
      { "rank": 23, "name": "Advance", "score": 7.2 },
      { "rank": 24, "name": "Excel", "score": 6.9 },
      { "rank": 25, "name": "Evoke Recognition", "score": 6.6 },
      { "rank": 26, "name": "Make The Team", "score": 6.3 },
      { "rank": 27, "name": "Do It Right", "score": 6.3 },
      { "rank": 28, "name": "Maximize", "score": 5.8 },
      { "rank": 29, "name": "Architect", "score": 4.9 },
      { "rank": 30, "name": "Systematize", "score": 4.1 },
      { "rank": 31, "name": "Finish", "score": 3.5 },
      { "rank": 32, "name": "Meet Requirements", "score": 3.3 }
    ]
  },

  "dimensions": {
    "strongest": [
      {
        "name": "Influencer",
        "description": "Energized by inspiring and shaping the world around you and helping others reach their potential. Sees possibilities and opportunities to transform and impact people, products, and outcomes. Seeks to persuade others to join efforts or adopt beliefs as building and creating something from nothing.",
        "blind_spots": {
          "when_not_at_best": "Desire to persuade and inspire others can come across as overbearing and potentially overshadow others' opinions and ideas. Might focus so much on big ideas that practical implementation steps are overlooked.",
          "advice": "Actively listen to and value the perspectives of others, integrating their insights into your vision. Ground inspirational ideas with actionable steps to ensure plans are as practical as they are motivational."
        }
      },
      {
        "name": "Visionary",
        "description": "Imagination and creativity know no bounds. Driven by the potential of what could be, constantly envisioning and dreaming up new possibilities. Passion for innovation and ability to see beyond the present reality empower bringing transformative ideas to life. Ability to dream big and commitment to making those dreams a reality are greatest strengths.",
        "blind_spots": {